<?xml version="1.0" encoding="UTF-8"?>
<fyzická_osoba 
xmlns="http://dia.gov.cz/ns/spolecne-casti-elektronickych-dokumentu/osoby" 
xmlns:xsi="http://www.w3.org/2001/XMLSchema-instance" 
xmlns:místa="http://dia.gov.cz/ns/spolecne-casti-elektronickych-dokumentu/mista" 
xsi:schemaLocation="http://dia.gov.cz/ns/spolecne-casti-elektronickych-dokumentu/osoby https://ofn.gov.cz/společné-části-elektronických-dokumentů/2024-10-04/schémata/osoby/fyzická-osoba.xsd">
	<jméno>Jana</jméno>
	<další_jména>Filoména</další_jména>
	<příjmení>Novotný</příjmení>
	<rodné_příjmení>Svobodová</rodné_příjmení>
	<datum_narození>2023-08-13</datum_narození>
	<trvalé_bydliště>
		<místa:adresní_místo>
			<místa:kód_adresního_místa>123456789</místa:kód_adresního_místa>
		</místa:adresní_místo>
	</trvalé_bydliště>
	<datová_schránka>abcdef</datová_schránka>
</fyzická_osoba>
